{
  "capture": {
    "capturedBytes": 1086,
    "durationNs": "6070000000",
    "endTimestampNs": "7070000000",
    "format": "pcap",
    "interfaces": [
      {
        "id": 0,
        "linkType": 1,
        "snapLength": 65535,
        "timestampResolution": "microseconds"
      }
    ],
    "originalBytes": 1086,
    "packetCount": 14,
    "startTimestampNs": "1000000000",
    "timestampResolution": "microseconds"
  },
  "contractVersion": "2.0.0",
  "diagnostics": [],
  "dnsExchanges": [
    {
      "answers": [
        {
          "class": 1,
          "name": "example.com",
          "type": 1,
          "value": "192.0.2.53"
        }
      ],
      "id": "dns-exchange-1",
      "latencyNs": "10000000",
      "matched": true,
      "queryPacketNumber": 1,
      "question": {
        "class": 1,
        "name": "example.com",
        "type": 1
      },
      "responseCode": "NOERROR",
      "responsePacketNumber": 2
    },
    {
      "answers": [
        {
          "class": 1,
          "name": "example.com",
          "type": 28,
          "value": "2001:db8::35"
        }
      ],
      "id": "dns-exchange-2",
      "latencyNs": "20000000",
      "matched": true,
      "queryPacketNumber": 3,
      "question": {
        "class": 1,
        "name": "example.com",
        "type": 28
      },
      "responseCode": "NOERROR",
      "responsePacketNumber": 4
    },
    {
      "answers": [
        {
          "class": 1,
          "name": "example.com",
          "type": 1,
          "value": "192.0.2.53"
        }
      ],
      "id": "dns-exchange-3",
      "latencyNs": "30000000",
      "matched": true,
      "queryPacketNumber": 5,
      "question": {
        "class": 1,
        "name": "example.com",
        "type": 1
      },
      "responseCode": "NOERROR",
      "responsePacketNumber": 6
    },
    {
      "answers": [
        {
          "class": 1,
          "name": "example.com",
          "type": 1,
          "value": "192.0.2.53"
        }
      ],
      "id": "dns-exchange-4",
      "latencyNs": "40000000",
      "matched": true,
      "queryPacketNumber": 7,
      "question": {
        "class": 1,
        "name": "example.com",
        "type": 1
      },
      "responseCode": "NOERROR",
      "responsePacketNumber": 8
    },
    {
      "answers": [
        {
          "class": 1,
          "name": "example.com",
          "type": 1,
          "value": "192.0.2.53"
        }
      ],
      "id": "dns-exchange-5",
      "latencyNs": "500000000",
      "matched": true,
      "queryPacketNumber": 9,
      "question": {
        "class": 1,
        "name": "example.com",
        "type": 1
      },
      "responseCode": "NOERROR",
      "responsePacketNumber": 10
    },
    {
      "answers": [],
      "id": "dns-exchange-6",
      "latencyNs": "60000000",
      "matched": true,
      "queryPacketNumber": 11,
      "question": {
        "class": 1,
        "name": "example.com",
        "type": 1
      },
      "responseCode": "NXDOMAIN",
      "responsePacketNumber": 12
    },
    {
      "answers": [],
      "id": "dns-exchange-7",
      "latencyNs": "70000000",
      "matched": true,
      "queryPacketNumber": 13,
      "question": {
        "class": 1,
        "name": "example.com",
        "type": 1
      },
      "responseCode": "SERVFAIL",
      "responsePacketNumber": 14
    }
  ],
  "endpoints": [
    {
      "address": "192.0.2.10",
      "addressFamily": "ipv4",
      "id": "endpoint-1",
      "port": 53000
    },
    {
      "address": "198.51.100.53",
      "addressFamily": "ipv4",
      "id": "endpoint-2",
      "port": 53
    }
  ],
  "flows": [
    {
      "capturedBytes": 1086,
      "clientEndpointId": "endpoint-1",
      "endTimestampNs": "7070000000",
      "id": "udp-flow-1",
      "originalBytes": 1086,
      "packetNumbers": [1, 2, 3, 4, 5, 6, 7, 8, 9, 10, 11, 12, 13, 14],
      "protocol": "UDP",
      "serverEndpointId": "endpoint-2",
      "startTimestampNs": "1000000000"
    }
  ],
  "observations": [
    {
      "id": "observation-1",
      "limitation": "Only packets in this capture were considered.",
      "message": "DNS response returned NXDOMAIN",
      "packetNumbers": [11, 12],
      "type": "dns-error"
    },
    {
      "id": "observation-2",
      "limitation": "Only packets in this capture were considered.",
      "message": "DNS response returned SERVFAIL",
      "packetNumbers": [13, 14],
      "type": "dns-error"
    },
    {
      "id": "observation-3",
      "limitation": "Only packets in this capture were considered.",
      "message": "DNS response latency met the slow-response rule",
      "packetNumbers": [9, 10],
      "type": "slow-dns"
    }
  ],
  "packets": [
    {
      "analysisFlags": [],
      "capturedLength": 71,
      "destinationEndpointId": "endpoint-2",
      "flowId": "udp-flow-1",
      "id": "packet-1",
      "interfaceId": 0,
      "layers": [
        {
          "byteRange": {
            "captureOffset": 40,
            "length": 71,
            "packetOffset": 0
          },
          "explanationKey": null,
          "fields": [
            {
              "byteRange": {
                "captureOffset": 40,
                "length": 6,
                "packetOffset": 0
              },
              "explanationKey": null,
              "name": "destinationMac",
              "value": "00:00:00:00:00:02"
            },
            {
              "byteRange": {
                "captureOffset": 46,
                "length": 6,
                "packetOffset": 6
              },
              "explanationKey": null,
              "name": "sourceMac",
              "value": "00:00:00:00:00:01"
            },
            {
              "byteRange": {
                "captureOffset": 52,
                "length": 2,
                "packetOffset": 12
              },
              "explanationKey": null,
              "name": "etherType",
              "value": "2048"
            }
          ],
          "label": "Ethernet II",
          "protocol": "ETHERNET"
        },
        {
          "byteRange": {
            "captureOffset": 54,
            "length": 57,
            "packetOffset": 14
          },
          "explanationKey": null,
          "fields": [
            {
              "byteRange": {
                "captureOffset": 54,
                "length": 1,
                "packetOffset": 14
              },
              "explanationKey": null,
              "name": "version",
              "value": "4"
            },
            {
              "byteRange": {
                "captureOffset": 54,
                "length": 1,
                "packetOffset": 14
              },
              "explanationKey": null,
              "name": "headerLength",
              "value": "20"
            },
            {
              "byteRange": {
                "captureOffset": 56,
                "length": 2,
                "packetOffset": 16
              },
              "explanationKey": null,
              "name": "totalLength",
              "value": "57"
            },
            {
              "byteRange": {
                "captureOffset": 62,
                "length": 1,
                "packetOffset": 22
              },
              "explanationKey": null,
              "name": "ttl",
              "value": "64"
            },
            {
              "byteRange": {
                "captureOffset": 63,
                "length": 1,
                "packetOffset": 23
              },
              "explanationKey": null,
              "name": "protocol",
              "value": "17"
            },
            {
              "byteRange": {
                "captureOffset": 66,
                "length": 4,
                "packetOffset": 26
              },
              "explanationKey": null,
              "name": "source",
              "value": "192.0.2.10"
            },
            {
              "byteRange": {
                "captureOffset": 70,
                "length": 4,
                "packetOffset": 30
              },
              "explanationKey": null,
              "name": "destination",
              "value": "198.51.100.53"
            }
          ],
          "label": "IPv4",
          "protocol": "IPV4"
        },
        {
          "byteRange": {
            "captureOffset": 74,
            "length": 37,
            "packetOffset": 34
          },
          "explanationKey": null,
          "fields": [
            {
              "byteRange": {
                "captureOffset": 74,
                "length": 2,
                "packetOffset": 34
              },
              "explanationKey": null,
              "name": "sourcePort",
              "value": "53000"
            },
            {
              "byteRange": {
                "captureOffset": 76,
                "length": 2,
                "packetOffset": 36
              },
              "explanationKey": null,
              "name": "destinationPort",
              "value": "53"
            },
            {
              "byteRange": {
                "captureOffset": 78,
                "length": 2,
                "packetOffset": 38
              },
              "explanationKey": null,
              "name": "length",
              "value": "37"
            },
            {
              "byteRange": {
                "captureOffset": 80,
                "length": 2,
                "packetOffset": 40
              },
              "explanationKey": null,
              "name": "checksum",
              "value": "0"
            }
          ],
          "label": "UDP",
          "protocol": "UDP"
        },
        {
          "byteRange": {
            "captureOffset": 82,
            "length": 29,
            "packetOffset": 42
          },
          "explanationKey": "dns",
          "fields": [
            {
              "byteRange": {
                "captureOffset": 82,
                "length": 2,